[
  {
    "H_branch": 0.2249961130145479,
    "H_rank": 0.9569109924989344,
    "H_sub": 0.23247974099789157,
    "dimension": 4,
    "id": "I-ondmax",
    "modulus": null,
    "n_samples": 10000,
    "ond_class": "I",
    "rank": 4
  },
  {
    "H_branch": 0.2241474485087468,
    "H_rank": 0.9572484893142591,
    "H_sub": 0.2315919310422216,
    "dimension": 4,
    "id": "II-lcg",
    "modulus": null,
    "n_samples": 10000,
    "ond_class": "II",
    "rank": 4
  },
  {
    "H_branch": 0.2250186087612778,
    "H_rank": 0.9575002275424379,
    "H_sub": 0.23235236249985516,
    "dimension": 4,
    "id": "II-xorshift",
    "modulus": null,
    "n_samples": 10000,
    "ond_class": "II",
    "rank": 4
  },
  {
    "H_branch": 0.22545846766319771,
    "H_rank": 0.9589967804966836,
    "H_sub": 0.23287234699083556,
    "dimension": 4,
    "id": "III-bounded",
    "modulus": null,
    "n_samples": 10000,
    "ond_class": "III",
    "rank": 4
  },
  {
    "H_branch": 0.22725908583377102,
    "H_rank": 0.9587948898759577,
    "H_sub": 0.23425914960741454,
    "dimension": 4,
    "id": "IV-masked",
    "modulus": null,
    "n_samples": 10000,
    "ond_class": "IV",
    "rank": 4
  },
  {
    "H_branch": 0.22557237810093797,
    "H_rank": 0.9581953394403275,
    "H_sub": 0.23285794162103374,
    "dimension": 4,
    "id": "Q-ideal",
    "modulus": null,
    "n_samples": 10000,
    "ond_class": "I",
    "rank": 4
  },
  {
    "H_branch": 0.1835502879276999,
    "H_rank": 0.9677352541860456,
    "H_sub": 0.2000973285614397,
    "dimension": 4,
    "id": "Q-drift",
    "modulus": null,
    "n_samples": 10000,
    "ond_class": "III",
    "rank": 4
  }
]